{
  "slice_id": "slice-001",
  "verdict": "approved",
  "timestamp": "2026-04-13T03:00:00Z",
  "ac_checks": [
    {
      "ac": "AC-001",
      "status": "pass",
      "evidence": "tests/slice-001/ac-tests.sh — [PASS] HTTP 200 recebido na rota /"
    },
    {
      "ac": "AC-002",
      "status": "pass",
      "evidence": "tests/slice-001/ac-tests.sh — [PASS] composer test retornou exit 0 (2 passed, 2 assertions)"
    },
    {
      "ac": "AC-003",
      "status": "pass",
      "evidence": "tests/slice-001/ac-tests.sh — [PASS] phpstan --level=8 retornou exit 0, No errors"
    },
    {
      "ac": "AC-004",
      "status": "pass",
      "evidence": "tests/slice-001/ac-tests.sh — [PASS] pint --test retornou exit 0"
    },
    {
      "ac": "AC-005",
      "status": "pass",
      "evidence": "tests/slice-001/ac-tests.sh — [PASS] todas as variáveis obrigatórias presentes no .env.example"
    }
  ],
  "violations": [],
  "next_action": "open_pr"
}
