{
  "slice_id": "slice-010",
  "verdict": "approved",
  "timestamp": "2026-04-15T14:00:00Z",
  "ac_checks": [
    {"ac": "AC-001", "status": "pass", "evidence": "tests/slice-010/LgpdCategoriesPageTest.php — AC-001: gerente autenticado com 2FA persiste base legal em lgpd_categories; AC-001a: rejeita 5a base; AC-001b: redireciona sem 2FA"},
    {"ac": "AC-002", "status": "pass", "evidence": "tests/slice-010/ConsentBlockingTest.php — AC-002: HTTP 422 sem base legal; AC-002a: tenant suspenso bloqueia antes da validacao LGPD"},
    {"ac": "AC-003", "status": "pass", "evidence": "tests/slice-010/ConsentRecordTest.php — AC-003: grava com SHA-256 user_agent_hash; AC-003a: checkbox nao marcado nao grava; AC-003b: append-only, canReceiveOn usa mais recente"},
    {"ac": "AC-004", "status": "pass", "evidence": "tests/slice-010/RevocationTokenTest.php — AC-004: revogacao valida grava status=revogado; AC-004a: token expirado gera novo; AC-004b: sem consentimento ativo nao grava"},
    {"ac": "AC-005", "status": "pass", "evidence": "tests/slice-010/ConsentRecordTest.php — canReceiveOn true/false conforme registro mais recente"},
    {"ac": "AC-006", "status": "pass", "evidence": "tests/slice-010/ConsentSubjectsPageTest.php — tabela paginada 50 linhas, filtro status, sem PII raw"},
    {"ac": "AC-007", "status": "pass", "evidence": "tests/slice-010/RevocationTokenTest.php — AC-007: confirmacao na tela + email; AC-007a: token invalido HTTP 404"},
    {"ac": "AC-008", "status": "pass", "evidence": "tests/slice-010/AuditAppendOnlyTest.php — UPDATE/DELETE/TRUNCATE recusados pelo trigger append-only; registro original intacto"}
  ],
  "violations": [],
  "next_action": "open_pr"
}
