{
  "slice_id": "slice-012",
  "verdict": "approved",
  "timestamp": "2026-04-15T21:45:00Z",
  "ac_checks": [
    {"ac": "AC-001", "status": "pass", "evidence": "tests/slice-012/ClienteCreationTest.php + tests/slice-012/CnpjClienteValidationTest.php — 4 tests, exit 0"},
    {"ac": "AC-002", "status": "pass", "evidence": "tests/slice-012/ClienteCreationTest.php + tests/slice-012/CpfValidationTest.php — 3 tests, exit 0"},
    {"ac": "AC-003", "status": "pass", "evidence": "tests/slice-012/ClienteCreationTest.php + tests/slice-012/CnpjClienteValidationTest.php — 4 tests, exit 0"},
    {"ac": "AC-004", "status": "pass", "evidence": "tests/slice-012/ClienteCreationTest.php + tests/slice-012/CpfValidationTest.php — 6 tests, exit 0"},
    {"ac": "AC-005", "status": "pass", "evidence": "tests/slice-012/ClienteUniquenessTest.php — 2 tests (CNPJ+CPF duplicado mesmo tenant), exit 0"},
    {"ac": "AC-006", "status": "pass", "evidence": "tests/slice-012/ClienteUniquenessTest.php — 1 test (mesmo CNPJ tenant diferente aceito), exit 0"},
    {"ac": "AC-007", "status": "pass", "evidence": "tests/slice-012/ClienteSoftDeleteTest.php — 2 tests (HTTP 200 + deleted_at preenchido), exit 0"},
    {"ac": "AC-008", "status": "pass", "evidence": "tests/slice-012/ClienteSoftDeleteTest.php — 2 tests (HTTP 409 + registro inalterado), exit 0"},
    {"ac": "AC-009", "status": "pass", "evidence": "tests/slice-012/ClienteMigrationTest.php — 3 tests (colunas ERD + seeder + unique index), exit 0"}
  ],
  "violations": [],
  "next_action": "open_pr"
}
