{
  "slice_id": "slice-011",
  "verdict": "approved",
  "timestamp": "2026-04-15T21:30:00Z",
  "ac_checks": [
    {"ac": "AC-001", "status": "pass", "evidence": "tests/slice-011/TenantIsolationModelTest.php — 16 datasets pass, exit 0"},
    {"ac": "AC-002", "status": "pass", "evidence": "tests/slice-011/TenantIsolationHttpTest.php:2 casos pass, exit 0"},
    {"ac": "AC-003", "status": "pass", "evidence": "tests/slice-011/TenantIsolationJobTest.php — AC-003 dataset pass, exit 0"},
    {"ac": "AC-004", "status": "pass", "evidence": "tests/slice-011/TenantIsolationExportTest.php — 2 casos pass, exit 0"},
    {"ac": "AC-005", "status": "pass", "evidence": "tests/slice-011/TenantIsolationCiTest.php — 2 casos pass, exit 0"},
    {"ac": "AC-006", "status": "pass", "evidence": "tests/slice-011/TenantIsolationPerformanceTest.php — 2 casos pass, exit 0"},
    {"ac": "AC-007", "status": "pass", "evidence": "tests/slice-011/TenantIsolationReadmeTest.php — 4 casos pass, exit 0"},
    {"ac": "AC-008", "status": "pass", "evidence": "tests/slice-011/TenantIsolationModelTest.php — AC-008 pass, exit 0"},
    {"ac": "AC-009", "status": "pass", "evidence": "tests/slice-011/TenantIsolationModelTest.php — AC-009 DB::raw SUM pass, exit 0"},
    {"ac": "AC-010", "status": "pass", "evidence": "tests/slice-011/TenantIsolationHttpTest.php — 2 casos query string + header pass, exit 0"},
    {"ac": "AC-011", "status": "pass", "evidence": "tests/slice-011/TenantIsolationHttpTest.php — AC-011 batch IDs pass, exit 0"},
    {"ac": "AC-012", "status": "pass", "evidence": "tests/slice-011/TenantIsolationJobTest.php — 2 casos retry pass, exit 0"},
    {"ac": "AC-013", "status": "pass", "evidence": "tests/slice-011/TenantIsolationExportTest.php — 2 casos soft-deleted pass, exit 0"},
    {"ac": "AC-014", "status": "pass", "evidence": "tests/slice-011/TenantIsolationCiTest.php — 2 casos paths filter pass, exit 0"},
    {"ac": "AC-015", "status": "pass", "evidence": "tests/slice-011/TenantIsolationModelTest.php + TenantIsolationPerformanceTest.php — 3 casos pass, exit 0"},
    {"ac": "AC-016", "status": "pass", "evidence": "tests/slice-011/TenantIsolationHttpTest.php + TenantIsolationSecurityTest.php — múltiplos datasets SQL injection pass, exit 0"}
  ],
  "violations": [],
  "next_action": "open_pr"
}
