{
  "slice_id": "slice-005",
  "verdict": "approved",
  "timestamp": "2026-04-12T23:00:00Z",
  "ac_checks": [
    {
      "ac": "AC-001",
      "status": "pass",
      "evidence": "tests/slice-005/HealthCheckTest.php — 'AC-001: GET /health retorna HTTP 200 quando DB e Redis estão up' + 'AC-001: GET /health retorna status \"ok\" no JSON quando todos os componentes estão conectados' — exit 0"
    },
    {
      "ac": "AC-002",
      "status": "pass",
      "evidence": "tests/slice-005/HealthCheckTest.php — 'AC-002: resposta JSON contém os campos obrigatórios status, db, redis e timestamp' + 'AC-002: campos db e redis retornam \"connected\"' + 'AC-002: campo timestamp é uma string ISO 8601 com timezone' — exit 0"
    },
    {
      "ac": "AC-003",
      "status": "pass",
      "evidence": "tests/slice-005/HealthCheckTest.php — 'AC-003: GET /health retorna HTTP 503 quando DB está indisponível' + 'AC-003: status é \"degraded\" e db é \"disconnected\" quando DB falha' + 'AC-003: GET /health retorna HTTP 503 quando Redis está indisponível' — exit 0"
    },
    {
      "ac": "AC-004",
      "status": "pass",
      "evidence": "tests/slice-005/HealthCheckTest.php — 'AC-004: HealthCheckController existe para que composer test --filter=HealthCheckTest funcione end-to-end' — exit 0"
    },
    {
      "ac": "AC-005",
      "status": "pass",
      "evidence": "tests/slice-005/HealthCheckTest.php — 'AC-005: HealthCheckController.php existe para análise do PHPStan' + 'AC-005: PHPStan level 8 não reporta erros no HealthCheckController' (4.74s) — exit 0"
    }
  ],
  "violations": [],
  "next_action": "open_pr"
}
