{
  "slice_id": "slice-011",
  "verdict": "approved",
  "timestamp": "2026-04-15T23:45:00Z",
  "ac_checks": [
    {"ac": "AC-001", "status": "pass", "evidence": "tests/slice-011/TenantIsolationModelTest.php — 124 passed + 10 skipped (markTestSkipped legítimos: model sem tenant() ou coluna numérica), exit 0"},
    {"ac": "AC-002", "status": "pass", "evidence": "tests/slice-011/TenantIsolationHttpTest.php linhas 15-16 — 2 rotas isoladas AC-002, exit 0"},
    {"ac": "AC-003", "status": "pass", "evidence": "tests/slice-011/TenantIsolationJobTest.php linha 47 — job despachado no tenant A não cria registros em B, exit 0"},
    {"ac": "AC-004", "status": "pass", "evidence": "tests/slice-011/TenantIsolationExportTest.php linhas 9-12 — payload export tenant A sem IDs de B, exit 0"},
    {"ac": "AC-005", "status": "pass", "evidence": "tests/slice-011/TenantIsolationCiTest.php linhas 3-6 — ci.yml contém job tenant-isolation referenciando testsuite Pest, exit 0"},
    {"ac": "AC-006", "status": "pass", "evidence": "tests/slice-011/TenantIsolationPerformanceTest.php linhas 135-138 — fixture <5s, phpunit.xml registrado, total 13.70s, exit 0"},
    {"ac": "AC-007", "status": "pass", "evidence": "tests/slice-011/TenantIsolationReadmeTest.php linhas 141-144 — README existe, bloco código, sensitive_models mencionado, exemplo após ≤2 parágrafos, exit 0"},
    {"ac": "AC-008", "status": "pass", "evidence": "tests/slice-011/TenantIsolationModelTest.php linha 129 — model sem BelongsToTenant causa falha explícita com nome do model, exit 0"},
    {"ac": "AC-009", "status": "pass", "evidence": "tests/slice-011/TenantIsolationModelTest.php linha 130 — DB::raw SUM retorna apenas soma tenant A, exit 0"},
    {"ac": "AC-010", "status": "pass", "evidence": "tests/slice-011/TenantIsolationHttpTest.php linhas 17-18 — query string tenant=B e header X-Tenant forjado não alteram contexto, exit 0"},
    {"ac": "AC-011", "status": "pass", "evidence": "tests/slice-011/TenantIsolationHttpTest.php linha 19 — DELETE batch cross-tenant retorna 403, nenhum ID processado, exit 0"},
    {"ac": "AC-012", "status": "pass", "evidence": "tests/slice-011/TenantIsolationJobTest.php linhas 48-49 — JobTenancyBootstrapper implementado em todos jobs, isolamento entre handle() consecutivos, exit 0"},
    {"ac": "AC-013", "status": "pass", "evidence": "tests/slice-011/TenantIsolationExportTest.php linhas 11-12 — withTrashed tenant A não expõe soft-deleted de B, exit 0"},
    {"ac": "AC-014", "status": "pass", "evidence": "tests/slice-011/TenantIsolationCiTest.php linhas 5-6 — paths filter declarado explicitamente, exit 0"},
    {"ac": "AC-015", "status": "pass", "evidence": "tests/slice-011/TenantIsolationModelTest.php linha 131 + TenantIsolationPerformanceTest.php linha 138 — overhead linear ≤4 casos por model adicional, exit 0"},
    {"ac": "AC-016", "status": "pass", "evidence": "tests/slice-011/TenantIsolationSecurityTest.php + TenantIsolationHttpTest.php — 12 vetores path param + 12 vetores POST + log auditoria, 134 passed total, exit 0"}
  ],
  "violations": [],
  "next_action": "open_pr"
}
