{
  "slice_id": "slice-002",
  "verdict": "approved",
  "timestamp": "2026-04-12T00:00:00Z",
  "ac_checks": [
    {
      "ac": "AC-001",
      "status": "pass",
      "evidence": "verification-input/test-results.txt:1-7 — migrate:fresh: 4 migrations DONE, EXIT=0"
    },
    {
      "ac": "AC-002",
      "status": "pass",
      "evidence": "verification-input/test-results.txt:9-10 — db:check stdout={\"db\":\"connected\",\"redis\":\"connected\"}, EXIT=0"
    },
    {
      "ac": "AC-003",
      "status": "pass",
      "evidence": "verification-input/test-results.txt:12-14 — tinker RLS query retornou OK sem exception, EXIT=0"
    },
    {
      "ac": "AC-004",
      "status": "pass",
      "evidence": "verification-input/test-results.txt:16-18 — config:cache sem erros, EXIT=0"
    },
    {
      "ac": "AC-005",
      "status": "pass",
      "evidence": "verification-input/test-results.txt:20-26 — migrate:status lista 0001_01_02_000000_create_sanity_check_table como Ran, EXIT=0"
    }
  ],
  "violations": [],
  "next_action": "open_pr"
}
