{
  "slice_id": "slice-006",
  "verdict": "approved",
  "timestamp": "2026-04-13T04:25:08Z",
  "ac_checks": [
    {
      "ac": "AC-001",
      "status": "pass",
      "evidence": "test-results.txt: Tests\\slice006\\ac006buildmanifestTest - npm run build retorna exit 0 e gera manifest com app.js e app.css"
    },
    {
      "ac": "AC-002",
      "status": "pass",
      "evidence": "test-results.txt: Tests\\slice006\\ac006pingrouteTest - GET /ping fora de production retorna 200 e Livewire OK"
    },
    {
      "ac": "AC-003",
      "status": "pass",
      "evidence": "test-results.txt: Tests\\slice006\\ac006buildmanifestTest - manifest gerado usa hash de conteudo e /ping referencia assets versionados"
    },
    {
      "ac": "AC-004",
      "status": "pass",
      "evidence": "test-results.txt: Tests\\slice006\\ac006staticanalysisTest - phpstan analyse em app/Livewire/Ping.php retorna exit 0"
    },
    {
      "ac": "AC-005",
      "status": "pass",
      "evidence": "test-results.txt: Tests\\slice006\\ac006livewirecommandTest - php artisan livewire:list retorna exit 0 e lista ping"
    },
    {
      "ac": "AC-006",
      "status": "pass",
      "evidence": "test-results.txt: Tests\\slice006\\ac006buildmanifestTest - validacao do manifest aponta a entrada Vite ausente"
    },
    {
      "ac": "AC-007",
      "status": "pass",
      "evidence": "test-results.txt: Tests\\slice006\\ac006pingrouteTest - /ping em production retorna 404 e nao fica exposto"
    },
    {
      "ac": "AC-008",
      "status": "pass",
      "evidence": "test-results.txt: Tests\\slice006\\ac006buildmanifestTest - validacao de hash aponta asset nao versionado"
    },
    {
      "ac": "AC-009",
      "status": "pass",
      "evidence": "test-results.txt: Tests\\slice006\\ac006staticanalysisTest - phpstan retorna exit diferente de 0 para um Ping com erro de tipo"
    },
    {
      "ac": "AC-010",
      "status": "pass",
      "evidence": "test-results.txt: Tests\\slice006\\ac006livewirecommandTest - livewire:list falha quando ping nao esta registrado"
    }
  ],
  "violations": [],
  "next_action": "open_pr"
}
