{
  "slice_id": "slice-003",
  "verdict": "approved",
  "timestamp": "2026-04-12T22:00:00Z",
  "ac_checks": [
    {
      "ac": "AC-001",
      "status": "pass",
      "evidence": "tests/slice-003/CiRuntimeTest.php — 'AC-001 runtime: pint --test falha com código mal formatado' passou (exit 0, test-results.txt:24); tests/slice-003/CiTriggerTest.php — trigger push cobre todas as branches (test-results.txt:35)"
    },
    {
      "ac": "AC-002",
      "status": "pass",
      "evidence": "tests/slice-003/CiRuntimeTest.php — 'AC-002 runtime: phpstan falha com erro de tipo nível 8' passou em 3.27s (test-results.txt:25); tests/slice-003/CiTriggerTest.php — trigger cobre feature branches (test-results.txt:36)"
    },
    {
      "ac": "AC-003",
      "status": "pass",
      "evidence": "tests/slice-003/CiRuntimeTest.php — 'AC-003 runtime: pest falha quando um teste está vermelho' passou (test-results.txt:26); tests/slice-003/CiTriggerTest.php — trigger cobre feature branches para job tests (test-results.txt:37)"
    },
    {
      "ac": "AC-004",
      "status": "pass",
      "evidence": "tests/slice-003/CiRuntimeTest.php:27 — 'AC-004 runtime: todos os jobs PHP dependem de harness'; tests/slice-003/CiJobsTest.php — todos os 7 jobs presentes, php-rector com --dry-run (test-results.txt:19-21)"
    },
    {
      "ac": "AC-005",
      "status": "pass",
      "evidence": "tests/slice-003/CiSbomTest.php — geração sbom-php.xml sem || true, upload-artifact configurado, step CycloneDX presente (test-results.txt:29-32)"
    }
  ],
  "violations": [],
  "next_action": "open_pr"
}
